{
  "schema_version": 1,
  "receipt_type": "mainframe-control-plane-gate-receipt",
  "receipt_id": "runtime-closure-source-suite-local-20260821",
  "gate_id": "runtime-closure",
  "proof_kind": "source-suite",
  "protocol_version": "1.0.0",
  "subject": {
    "kind": "source",
    "source_revision": "802b0605cfc0ee871c281b2ed6ced91d2e316fcd",
    "source_tree_sha256": "31208e9a28044598f0a4736f8096931822a2ba1d04f42c7e64fac0e572a2a186",
    "inventory_sha256": null,
    "payload_sha256": null,
    "version": "10.2.0"
  },
  "command": {
    "identity": "mainframe.runtime-closure.source.v1",
    "argv": [
      "python3",
      "-I",
      "-S",
      "-B",
      "scripts/generate-runtime-closure.py",
      "--check"
    ]
  },
  "environment": {
    "os": "darwin",
    "architecture": "arm64",
    "runner_class": "maintainer-local"
  },
  "issued_at": "2026-08-22T19:51:03Z",
  "expires_at": "2026-08-23T19:51:03Z",
  "evidence": [
    {
      "path": "config/runtime-closure.json",
      "sha256": "ca11a2fdb6258c787ee1fe43f25b7d5c2d2d39540339a4158407e9ef4fce66a8",
      "role": "source-evidence"
    },
    {
      "path": "scripts/generate-runtime-closure.py",
      "sha256": "6f06b879c88b796d00f3221dfb577b0aae188ac51faceb6a201152af11f9637f",
      "role": "source-evidence"
    },
    {
      "path": "tests/runtime_closure.bats",
      "sha256": "8d8f6a1866c7fc16bb93a6160279d6a496806cc71d4b29eb5ff4c159599f0e93",
      "role": "source-evidence"
    }
  ],
  "result": "pass",
  "authority": {
    "class": "local-verifier",
    "signer_id": "scripts/check-control-plane-claim.py",
    "independence": "project",
    "signature": null
  },
  "limitations": [
    "Local source closure verification only; this is not installed-runtime or host enforcement evidence."
  ]
}
