{
  "schema_version": 1,
  "receipt_type": "mainframe-control-plane-gate-receipt",
  "receipt_id": "project-memory-contract-privacy-recovery-no-fallback-local-20260821",
  "gate_id": "project-memory-contract",
  "proof_kind": "privacy-recovery-no-fallback",
  "protocol_version": "1.0.0",
  "subject": {
    "kind": "source",
    "source_revision": "56398f758b9b9337c64db1faa1f598d95f364551",
    "source_tree_sha256": "96068bfd4ced170308453ad9b75cde81b8bedaf07f65fcb980d117ee22216fca",
    "inventory_sha256": null,
    "payload_sha256": null,
    "version": "10.2.0"
  },
  "command": {
    "identity": "mainframe.project-memory.privacy-recovery.v1",
    "argv": [
      "bats",
      "tests/durable_project_memory_route.bats"
    ]
  },
  "environment": {
    "os": "darwin",
    "architecture": "arm64",
    "runner_class": "maintainer-local"
  },
  "issued_at": "2026-08-21T16:19:15Z",
  "expires_at": "2026-08-22T16:19:15Z",
  "evidence": [
    {
      "path": "bin/mainframe",
      "sha256": "7ea40d3c2d5be4dad7485ac6fa28bdef4ec2a3dcc026b65b9cd9143affcc05fe",
      "role": "source-evidence"
    },
    {
      "path": "lib/durable_awm.sh",
      "sha256": "6144ab91ec0af92e7f19c112e02bc10a9d38719e1cf376140d8ab31c1cd33235",
      "role": "source-evidence"
    },
    {
      "path": "control_plane/mainframe_control_plane/memory.py",
      "sha256": "dd24e3a3319d167daf68ff6790b7fcebc5fdbcd2095249248bc8439da7f95bfa",
      "role": "source-evidence"
    },
    {
      "path": "control_plane/mainframe_control_plane/memory_executor.py",
      "sha256": "b04e178d4bc99e2751bc93ae4c951a086b88352bf0a2f0daf15f7f5fdcb2a25b",
      "role": "source-evidence"
    },
    {
      "path": "control_plane/mainframe_control_plane/memory_transient.py",
      "sha256": "234dee7a7314bc3a3319bad8ff9f10a927df7cf634d94b8d67c20e4ae850c03f",
      "role": "source-evidence"
    },
    {
      "path": "control_plane/mainframe_control_plane/cli.py",
      "sha256": "aa7988bef84175d823cfa7bbd75060f4a427eef0008cc6e90524f91e28df02c6",
      "role": "source-evidence"
    },
    {
      "path": "control_plane/mainframe_control_plane/kernel.py",
      "sha256": "4d0b55809f1e0c10cef6bce239943293bdf40c6664ace44185361fcf2e47ec6f",
      "role": "source-evidence"
    },
    {
      "path": "tests/control_plane/test_project_memory.py",
      "sha256": "d5cc16e5f31e6eb2f82d89a602ba863193a9d451eb6e88cfa16cdaa318c90a6a",
      "role": "source-evidence"
    },
    {
      "path": "tests/control_plane/test_project_memory_reads.py",
      "sha256": "07579fa228f30d1071bf8c8799be3893275adce261245a7ea14af0ebfc7d7741",
      "role": "source-evidence"
    },
    {
      "path": "tests/control_plane/test_project_memory_integration.py",
      "sha256": "4196451e619b79211f9538ba6b10d7dc715307c562a978c6fd4498c087244d18",
      "role": "source-evidence"
    },
    {
      "path": "tests/durable_project_memory_route.bats",
      "sha256": "9a59da60a6da5f085b3c73c10d67370514ff4332c8e7901cd874fc2e8fc6d030",
      "role": "source-evidence"
    }
  ],
  "result": "pass",
  "authority": {
    "class": "local-verifier",
    "signer_id": "scripts/check-control-plane-claim.py",
    "independence": "project",
    "signature": null
  },
  "limitations": [
    "Local source proof covers metadata-only durability, transient-result privacy, recovery, and no legacy fallback; it is not an independent privacy audit."
  ]
}
