{
  "schema_version": 1,
  "receipt_type": "mainframe-control-plane-gate-receipt",
  "receipt_id": "runtime-closure-source-suite-local-20260924-fc1a9d3",
  "gate_id": "runtime-closure",
  "proof_kind": "source-suite",
  "protocol_version": "1.0.0",
  "subject": {
    "kind": "source",
    "source_revision": "fc1a9d3ead34217cbd00c62212447524389a3899",
    "source_tree_sha256": "12dcd332afaf9d5a26df44fbc9336d28db09506c9dd2a3bd811202dd360dcfd3",
    "inventory_sha256": null,
    "payload_sha256": null,
    "version": "10.3.1"
  },
  "command": {
    "identity": "mainframe.runtime-closure.source.v1",
    "argv": [
      "python3",
      "-I",
      "-S",
      "-B",
      "scripts/generate-runtime-closure.py",
      "--check"
    ]
  },
  "environment": {
    "os": "linux",
    "architecture": "x86_64",
    "runner_class": "maintainer-local"
  },
  "issued_at": "2026-09-24T22:41:06Z",
  "expires_at": "2026-10-01T22:41:06Z",
  "evidence": [
    {
      "path": "config/runtime-closure.json",
      "sha256": "ca11a2fdb6258c787ee1fe43f25b7d5c2d2d39540339a4158407e9ef4fce66a8",
      "role": "source-evidence"
    },
    {
      "path": "scripts/generate-runtime-closure.py",
      "sha256": "6f06b879c88b796d00f3221dfb577b0aae188ac51faceb6a201152af11f9637f",
      "role": "source-evidence"
    },
    {
      "path": "tests/runtime_closure.bats",
      "sha256": "8d8f6a1866c7fc16bb93a6160279d6a496806cc71d4b29eb5ff4c159599f0e93",
      "role": "source-evidence"
    }
  ],
  "result": "pass",
  "authority": {
    "class": "local-verifier",
    "signer_id": "scripts/check-control-plane-claim.py",
    "independence": "project",
    "signature": null
  },
  "limitations": [
    "Fresh fixed-verifier source execution only; not installed Pi, public distribution, external approval-authority, or independent outcome evidence.",
    "Earlier receipts remain unchanged and are not promoted by this record."
  ]
}
