{
  "schema_version": 1,
  "receipt_type": "mainframe-control-plane-gate-receipt",
  "receipt_id": "reviewed-broker-routing-kernel-routed-stable-core-local-20260924-67aa389",
  "gate_id": "reviewed-broker-routing",
  "proof_kind": "kernel-routed-stable-core",
  "protocol_version": "1.0.0",
  "subject": {
    "kind": "source",
    "source_revision": "67aa3899947d55b523432506321b6f8a904591b1",
    "source_tree_sha256": "2968ca4c30a5deb28db7b394df412538939609f54d495b4ea8f57d23eea3cdc2",
    "inventory_sha256": null,
    "payload_sha256": null,
    "version": "10.3.1"
  },
  "command": {
    "identity": "mainframe.reviewed-broker.kernel-route.v1",
    "argv": [
      "python3",
      "-I",
      "-S",
      "-B",
      "tests/control_plane/test_stable_core.py"
    ]
  },
  "environment": {
    "os": "linux",
    "architecture": "x86_64",
    "runner_class": "maintainer-local"
  },
  "issued_at": "2026-09-24T22:34:19Z",
  "expires_at": "2026-10-01T22:34:19Z",
  "evidence": [
    {
      "path": "config/stable-core.json",
      "sha256": "481c5df1bae3f46d67c0b382a5763d3775d167926ab36db888d0ba5ef0c7dfa4",
      "role": "source-evidence"
    },
    {
      "path": "tests/control_plane/public_cli.bats",
      "sha256": "09fe201fbee135df28113a15f9ec3ee04f79d220f71d1ad32f5e1914bcdf3da2",
      "role": "source-evidence"
    }
  ],
  "result": "pass",
  "authority": {
    "class": "local-verifier",
    "signer_id": "scripts/check-control-plane-claim.py",
    "independence": "project",
    "signature": null
  },
  "limitations": [
    "Fresh fixed-verifier source execution only; not installed Pi, public distribution, external approval-authority, or independent outcome evidence.",
    "Earlier receipts remain unchanged and are not promoted by this record."
  ]
}
