{
  "schema_version": 1,
  "receipt_type": "mainframe-control-plane-gate-receipt",
  "receipt_id": "adapter-contract-instruction-contract-local-20260821",
  "gate_id": "adapter-contract",
  "proof_kind": "instruction-contract",
  "protocol_version": "1.0.0",
  "subject": {
    "kind": "source",
    "source_revision": "2567cd6b2d813b728cbc7525f6fecbdce1164fcd",
    "source_tree_sha256": "268c077036bc29272b45efad00bdbb80a1fd1469c02b8e34a5433bd350f0b60d",
    "inventory_sha256": null,
    "payload_sha256": null,
    "version": "10.2.0"
  },
  "command": {
    "identity": "mainframe.adapter-contract.instructions.v1",
    "argv": [
      "/bin/bash",
      "--noprofile",
      "--norc",
      "-p",
      "scripts/generate-host-adapters.sh",
      "--check"
    ]
  },
  "environment": {
    "os": "darwin",
    "architecture": "arm64",
    "runner_class": "maintainer-local"
  },
  "issued_at": "2026-08-21T21:04:48Z",
  "expires_at": "2026-08-22T21:04:48Z",
  "evidence": [
    {
      "path": "config/host-capabilities.json",
      "sha256": "0b4a8b98161b5caddf7a2ebdfd26d1c2b8f0a8967fbbf89818cdf2ed4b1e3fc5",
      "role": "source-evidence"
    },
    {
      "path": "scripts/generate-host-adapters.sh",
      "sha256": "4d65e66fc1916629e9aa37c918e3d1e2a776e1cd9d47c8a5c01e713a43378aef",
      "role": "source-evidence"
    },
    {
      "path": "tests/host_capabilities.bats",
      "sha256": "3d677f7f47bb9bb2754a8af1474b19d069670b7febbe35bb184512cd7b4f2a0f",
      "role": "source-evidence"
    }
  ],
  "result": "pass",
  "authority": {
    "class": "local-verifier",
    "signer_id": "scripts/check-control-plane-claim.py",
    "independence": "project",
    "signature": null
  },
  "limitations": [
    "Generated instruction parity is source evidence only; instruction-only hosts do not enforce non-shell routes."
  ]
}
