{
  "schema_version": 1,
  "receipt_type": "mainframe-control-plane-gate-receipt",
  "receipt_id": "adapter-contract-kernel-routed-adapters-local-20260821",
  "gate_id": "adapter-contract",
  "proof_kind": "kernel-routed-adapters",
  "protocol_version": "1.0.0",
  "subject": {
    "kind": "source",
    "source_revision": "95319fa1e55252b1d8e0f3384dedd352250b2427",
    "source_tree_sha256": "f7cd7e3f1f9a29075a32541c253f0fbcecd0a1532588954499f5641e990f38ba",
    "inventory_sha256": null,
    "payload_sha256": null,
    "version": "10.2.0"
  },
  "command": {
    "identity": "mainframe.adapter-contract.kernel-route.v1",
    "argv": [
      "bats",
      "tests/adapter_kernel_route.bats"
    ]
  },
  "environment": {
    "os": "darwin",
    "architecture": "arm64",
    "runner_class": "maintainer-local"
  },
  "issued_at": "2026-08-21T18:18:52Z",
  "expires_at": "2026-08-22T18:18:52Z",
  "evidence": [
    {
      "path": "config/host-capabilities.json",
      "sha256": "0b4a8b98161b5caddf7a2ebdfd26d1c2b8f0a8967fbbf89818cdf2ed4b1e3fc5",
      "role": "source-evidence"
    },
    {
      "path": "scripts/generate-host-adapters.sh",
      "sha256": "4d65e66fc1916629e9aa37c918e3d1e2a776e1cd9d47c8a5c01e713a43378aef",
      "role": "source-evidence"
    },
    {
      "path": "tests/host_capabilities.bats",
      "sha256": "3d677f7f47bb9bb2754a8af1474b19d069670b7febbe35bb184512cd7b4f2a0f",
      "role": "source-evidence"
    }
  ],
  "result": "pass",
  "authority": {
    "class": "local-verifier",
    "signer_id": "scripts/check-control-plane-claim.py",
    "independence": "project",
    "signature": null
  },
  "limitations": [
    "Local source proof covers reviewed Pi and MCP kernel routing; it is not installed-host interception evidence."
  ]
}
