{
  "schema_version": 1,
  "receipt_type": "mainframe-control-plane-gate-receipt",
  "receipt_id": "release-integrity-archive-reproducibility-local-20260905",
  "gate_id": "release-integrity",
  "proof_kind": "archive-reproducibility",
  "protocol_version": "1.0.0",
  "subject": {
    "kind": "source",
    "source_revision": "959d64c9c6049da52c0dc3371266d628df9886cc",
    "source_tree_sha256": "4ec75682e9aa6bc5c4958a427b2126143cdabbe4e4958a9bf40e7c149a005f28",
    "inventory_sha256": null,
    "payload_sha256": null,
    "version": "10.2.0"
  },
  "command": {
    "identity": "mainframe.release-integrity.archive.v1",
    "argv": [
      "/bin/bash",
      "--noprofile",
      "--norc",
      "-p",
      "scripts/build-release-archive.sh",
      "--verify"
    ]
  },
  "environment": {
    "os": "darwin",
    "architecture": "arm64",
    "runner_class": "maintainer-local"
  },
  "issued_at": "2026-09-05T15:40:24Z",
  "expires_at": "2026-09-12T15:40:24Z",
  "evidence": [
    {
      "path": "scripts/dev/release.sh",
      "sha256": "40547e369919f25108ad67d43337d984782ff53357372037098301fda5f93c4d",
      "role": "source-evidence"
    },
    {
      "path": "scripts/dev/release-payload.sh",
      "sha256": "4f3e956c004dd246a5bbaeea5bb19da7fbd532026605406cd7dad189f5dd0a14",
      "role": "source-evidence"
    },
    {
      "path": "scripts/generate-sbom.sh",
      "sha256": "c62460dd973db6c776f11e472630c1df983c7b7e7d9dc6417208f3e6af94da14",
      "role": "source-evidence"
    },
    {
      "path": "scripts/build-release-archive.sh",
      "sha256": "1c8880c190d142b5c13f127d06c209b5ff292e63365296c1880ab655a8092143",
      "role": "source-evidence"
    },
    {
      "path": "tests/release-archive.bats",
      "sha256": "ce41fe4425fcdee643ba1b7f630dd607e2c2f88326eeb94c55ef78c15b39b3e3",
      "role": "source-evidence"
    },
    {
      "path": "config/release-attestation-exclusions.txt",
      "sha256": "c26b3e5a4c6821295535d6042be4eadf29d6dcf7de8426c850fbbf54ea85df95",
      "role": "source-evidence"
    },
    {
      "path": "SHA256SUMS",
      "sha256": "5e71118c47bc41ff62fc4542fa699859d65efe514ff22477a99aa7a1f1943fa9",
      "role": "inventory"
    }
  ],
  "result": "pass",
  "authority": {
    "class": "local-verifier",
    "signer_id": "scripts/check-control-plane-claim.py",
    "independence": "project",
    "signature": null
  },
  "limitations": [
    "Local reproducibility verification only; this is not a published archive attestation."
  ]
}
