{
  "schema_version": 1,
  "receipt_type": "mainframe-control-plane-gate-receipt",
  "receipt_id": "coding-agent-contract-public-safe-read-search-local-20260821",
  "gate_id": "coding-agent-contract",
  "proof_kind": "public-safe-read-search",
  "protocol_version": "1.0.0",
  "subject": {
    "kind": "source",
    "source_revision": "87d9c252ed38e4169a8b684797ae6d0e37411911",
    "source_tree_sha256": "9effc09754399f98d92eff2143f84efbbed5940250318d8bd6fc25ff0484a90d",
    "inventory_sha256": null,
    "payload_sha256": null,
    "version": "10.2.0"
  },
  "command": {
    "identity": "mainframe.coding-agent.public-safe-reads.v1",
    "argv": [
      "python3",
      "-I",
      "-S",
      "-B",
      "tests/control_plane/test_coding_public.py"
    ]
  },
  "environment": {
    "os": "darwin",
    "architecture": "arm64",
    "runner_class": "maintainer-local"
  },
  "issued_at": "2026-08-21T19:23:20Z",
  "expires_at": "2026-08-22T19:23:20Z",
  "evidence": [
    {
      "path": "control_plane/mainframe_control_plane/coding.py",
      "sha256": "4efa61f24a31bc025fd5cc1c27e02380579e7c5e7bef56e82fe9a9c2aec5d5dd",
      "role": "source-evidence"
    },
    {
      "path": "control_plane/mainframe_control_plane/cli.py",
      "sha256": "aa7988bef84175d823cfa7bbd75060f4a427eef0008cc6e90524f91e28df02c6",
      "role": "source-evidence"
    },
    {
      "path": "control_plane/mainframe_control_plane/kernel.py",
      "sha256": "4d0b55809f1e0c10cef6bce239943293bdf40c6664ace44185361fcf2e47ec6f",
      "role": "source-evidence"
    },
    {
      "path": "tests/control_plane/test_coding_agent.py",
      "sha256": "8abc6c5d87b843913fee767ffc038419be101e2e445b61d3fc098f529eca6880",
      "role": "source-evidence"
    },
    {
      "path": "tests/control_plane/test_coding_public.py",
      "sha256": "90cc03dd709e9049da97a094c5c8f9e81f5bc9b9311f14fed607c79b2590be42",
      "role": "source-evidence"
    }
  ],
  "result": "pass",
  "authority": {
    "class": "local-verifier",
    "signer_id": "scripts/check-control-plane-claim.py",
    "independence": "project",
    "signature": null
  },
  "limitations": [
    "Local source proof covers reviewed coding read and search behavior only; it does not authorize edit, test, or build effects."
  ]
}
