{
  "schema_version": 1,
  "receipt_type": "mainframe-control-plane-gate-receipt",
  "receipt_id": "reviewed-broker-routing-kernel-routed-stable-core-local-20260821",
  "gate_id": "reviewed-broker-routing",
  "proof_kind": "kernel-routed-stable-core",
  "protocol_version": "1.0.0",
  "subject": {
    "kind": "source",
    "source_revision": "369dc2a9ff6dd2cda5b9e2113e7bb0de8098e8a4",
    "source_tree_sha256": "20167eec81689bea6267449a9b18c3bad2ea178190c252f6294f240ac80d8050",
    "inventory_sha256": null,
    "payload_sha256": null,
    "version": "10.2.0"
  },
  "command": {
    "identity": "mainframe.reviewed-broker.kernel-route.v1",
    "argv": [
      "python3",
      "-I",
      "-S",
      "-B",
      "tests/control_plane/test_stable_core.py"
    ]
  },
  "environment": {
    "os": "darwin",
    "architecture": "arm64",
    "runner_class": "maintainer-local"
  },
  "issued_at": "2026-08-21T14:57:33Z",
  "expires_at": "2026-08-22T14:57:33Z",
  "evidence": [
    {
      "path": "config/stable-core.json",
      "sha256": "481c5df1bae3f46d67c0b382a5763d3775d167926ab36db888d0ba5ef0c7dfa4",
      "role": "source-evidence"
    },
    {
      "path": "tests/control_plane/public_cli.bats",
      "sha256": "09fe201fbee135df28113a15f9ec3ee04f79d220f71d1ad32f5e1914bcdf3da2",
      "role": "source-evidence"
    }
  ],
  "result": "pass",
  "authority": {
    "class": "local-verifier",
    "signer_id": "scripts/check-control-plane-claim.py",
    "independence": "project",
    "signature": null
  },
  "limitations": [
    "Local source proof covers only the reviewed stable-core kernel route; it is not installed-host or mutation authority evidence."
  ]
}
